{
  "kind": "truth_review",
  "schema_version": "2.0.0",
  "initiative": {
    "name": "Checkout migration launch readiness",
    "owner": "Platform TPM",
    "objective": "Ship the checkout migration on time with verifiable readiness."
  },
  "as_of": "2026-08-11T00:00:00.000Z",
  "policy": {
    "max_observation_age_days": 14,
    "max_source_content_age_days": 14
  },
  "artifact_quality": "needs_review",
  "reported_program_health": null,
  "claim_health_floor": "none",
  "program_health": "unknown",
  "health_consistency": "missing",
  "summary": {
    "sources": 1,
    "claims": 1,
    "facts": 1,
    "blockers": 0,
    "risks": 0,
    "unknowns": 0,
    "conflicts": 0,
    "issues": 1,
    "deprecations": 0
  },
  "sources": [
    {
      "id": "release-status",
      "type": "status-note",
      "url": "https://example.com/status/checkout-release",
      "observed_at": "2026-08-10T09:00:00.000Z",
      "source_updated_at": "2026-08-10T09:00:00.000Z"
    }
  ],
  "claims": [
    {
      "id": "release-ready",
      "kind": "fact",
      "state": "active",
      "subject": "release.ready",
      "value": false,
      "text": "Release readiness is false.",
      "source_refs": [
        {
          "source_id": "release-status",
          "locator": "https://example.com/status/checkout-release"
        }
      ]
    }
  ],
  "findings": {
    "facts": [
      {
        "id": "release-ready",
        "kind": "fact",
        "state": "active",
        "subject": "release.ready",
        "value": false,
        "text": "Release readiness is false.",
        "source_refs": [
          {
            "source_id": "release-status",
            "locator": "https://example.com/status/checkout-release"
          }
        ]
      }
    ],
    "blockers": [],
    "risks": [],
    "unknowns": [],
    "conflicts": [],
    "issues": [
      {
        "type": "missing_health_assessment",
        "severity": "review",
        "location": "health_assessment",
        "message": "Add an explicit health assessment with state, owner, rationale, and cited source references; facts alone do not establish on_track health."
      }
    ],
    "deprecations": []
  },
  "recommended_actions": [
    {
      "priority": "P2",
      "type": "improve_evidence",
      "action": "Add an explicit health assessment with state, owner, rationale, and cited source references; facts alone do not establish on_track health.",
      "location": "health_assessment"
    }
  ]
}
